{"$id":"https://hasarbotu.local/schemas/value-loss-rule-snapshot-1.0.0.json","$schema":"https://json-schema.org/draft/2020-12/schema","additionalProperties":false,"properties":{"ageCoefficients":{"items":{"type":"object"},"maxItems":8,"minItems":8,"type":"array"},"anomalies":{"items":{"type":"object"},"minItems":15,"type":"array"},"applicationPrinciples":{"items":{"type":"object"},"minItems":1,"type":"array"},"cachedFormulaErrors":{"items":{"type":"object"},"maxItems":2,"minItems":2,"type":"array"},"dataValidations":{"items":{"type":"object"},"maxItems":2,"minItems":2,"type":"array"},"effectiveDate":{"const":"2026-07-01"},"generalModifiers":{"items":{"type":"object"},"maxItems":3,"minItems":3,"type":"array"},"identity":{"const":"real-market-analysis/2026-07-01/1.0.0"},"partRules":{"items":{"type":"object"},"minItems":1,"type":"array"},"partTables":{"items":{"type":"object"},"maxItems":6,"minItems":6,"type":"array"},"schemaVersion":{"const":"value-loss-rule-snapshot/1.0.0"},"sections":{"items":{"type":"object"},"maxItems":6,"minItems":6,"type":"array"},"sheets":{"items":{"type":"object"},"minItems":4,"type":"array"},"source":{"additionalProperties":false,"properties":{"extractorVersion":{"minLength":1,"type":"string"},"workbookFileName":{"const":"Yeni Dönem Değer Kaybı Hesaplama Modülü 01.07.2026 V_1.xlsx"},"workbookSha256":{"const":"81d3ae870cd5569b13371ec8b4de081a9a4e3e15098f7454f5d0cdcd3708c424"}},"required":["workbookFileName","workbookSha256","extractorVersion"],"type":"object"},"usageCoefficientTables":{"items":{"type":"object"},"maxItems":7,"minItems":7,"type":"array"},"vehicleGroupCodeSequence":{"items":{"type":"object"},"maxItems":14,"minItems":14,"type":"array"},"vehicleMappings":{"items":{"type":"object"},"maxItems":14,"minItems":14,"type":"array"}},"required":["schemaVersion","identity","effectiveDate","source","sheets","vehicleGroupCodeSequence","vehicleMappings","ageCoefficients","usageCoefficientTables","generalModifiers","partTables","partRules","applicationPrinciples","dataValidations","cachedFormulaErrors","sections","anomalies"],"title":"HasarBotu Paket 66 Değer Kaybı Kaynak Snapshot","type":"object"}
