{"ageCoefficients":[{"coefficient":"1","maxAge":2,"minAge":0,"sourceRange":"Tablolar!B19:C26","sourceRow":26},{"coefficient":"0.95","maxAge":4,"minAge":3,"sourceRange":"Tablolar!B19:C26","sourceRow":25},{"coefficient":"0.9","maxAge":7,"minAge":5,"sourceRange":"Tablolar!B19:C26","sourceRow":24},{"coefficient":"0.85","maxAge":10,"minAge":8,"sourceRange":"Tablolar!B19:C26","sourceRow":23},{"coefficient":"0.8","maxAge":13,"minAge":11,"sourceRange":"Tablolar!B19:C26","sourceRow":22},{"coefficient":"0.75","maxAge":16,"minAge":14,"sourceRange":"Tablolar!B19:C26","sourceRow":21},{"coefficient":"0.7","maxAge":19,"minAge":17,"sourceRange":"Tablolar!B19:C26","sourceRow":20},{"coefficient":"0.65","maxAge":null,"minAge":20,"sourceRange":"Tablolar!B19:C26","sourceRow":19}],"anomalies":[{"code":"source_vehicle_name_column_incomplete","evidenceRefs":["Tablolar!C3:C16","Tablolar!B4:C6"],"provenance":"source_workbook"},{"code":"orphan_shared_strings_not_vehicle_mapping_source","evidenceRefs":["xl/sharedStrings.xml"],"provenance":"source_workbook"},{"code":"source_validation_adjustment_list_f12","evidenceRefs":["Hesaplama!F12"],"provenance":"source_workbook"},{"code":"source_validation_adjustment_list_z2","evidenceRefs":["Tablolar!Z2"],"provenance":"source_workbook"},{"code":"source_cached_name_error","evidenceRefs":["Hesaplama!M18"],"provenance":"source_workbook"},{"code":"source_cached_div0_error","evidenceRefs":["Hesaplama!M19"],"provenance":"source_workbook"},{"code":"source_age_table_reverse_order","evidenceRefs":["Tablolar!B19:C26"],"provenance":"source_workbook"},{"code":"source_row_27_residual_79","evidenceRefs":["Tablolar!27:27","shared-string-index:79"],"provenance":"source_workbook"},{"code":"source_hidden_sheet","evidenceRefs":["Sheet1!C3:J11"],"provenance":"source_workbook"},{"code":"source_unused_insurer_list","evidenceRefs":["Tablolar!B299:B350"],"provenance":"source_workbook"},{"code":"source_unused_market_value_coefficient_table","evidenceRefs":["Tablolar!E2:R9"],"provenance":"source_workbook"},{"code":"source_year_c13_formula_error","evidenceRefs":["Hesaplama!C64","Hesaplama!K64"],"provenance":"source_workbook"},{"code":"source_scratch_cells_m18_m19","evidenceRefs":["Hesaplama!M18:M19"],"provenance":"source_workbook"},{"code":"source_unwired_j11","evidenceRefs":["Hesaplama!J11","Hesaplama!H1"],"provenance":"source_workbook"},{"code":"source_later_additions_dormant","evidenceRefs":["Tablolar!B264:L295"],"provenance":"source_workbook"}],"applicationPrinciples":[{"sourceCell":"Uygulama Esasları!B3","text":"REEL PİYASA ANALİZ YÖNTEMİ ESASIYLA HESAPLAMA REHBERİ UYGULAMA ESASLARI"},{"sourceCell":"Uygulama Esasları!B5","text":"1. AMAÇ VE KAPSAM"},{"sourceCell":"Uygulama Esasları!B6","text":"Bu kılavuz; motorlu kara taşıtlarında meydana gelen hasarlar sonrası oluşan değer kaybının, gerçek zarar ilkesi, reel piyasa verileri ve objektif teknik kriterler esas alınarak ölçülebilir bir tazminat hesaplanmasını sağlamak amacıyla hazırlanmıştır."},{"sourceCell":"Uygulama Esasları!B7","text":"Bu yöntem ile;"},{"sourceCell":"Uygulama Esasları!B8","text":"Değer kaybı tazminat hesaplamalarında yeknesaklığın sağlanması,"},{"sourceCell":"Uygulama Esasları!B9","text":"Değer kaybı tazminat hesaplamalarının ölçülebilir, izlenebilir ve denetlenebilir hale getirilmesi,"},{"sourceCell":"Uygulama Esasları!B10","text":"Yargı kararları ile uyumlu bilimsel ve teknik bir model oluşturulması,"},{"sourceCell":"Uygulama Esasları!B11","text":"Değer kaybı tazminat hesaplamalarında subjektif değerlendirmelerin en aza indirilmesi,"},{"sourceCell":"Uygulama Esasları!B12","text":"hedeflenmektedir."},{"sourceCell":"Uygulama Esasları!B13","text":"2. TEMEL İLKELER"},{"sourceCell":"Uygulama Esasları!B15","text":"2.1 Değer kaybı tazminat hesaplaması; aracın kaza öncesi hasarsız rayiç değeri ile onarım sonrası piyasa rayiç değeri arasındaki fark gözetilerek Yargıtay tarafından belirlenen parametreler esas alınarak yapılır."},{"sourceCell":"Uygulama Esasları!B17","text":"2.2 Hesaplamalarda esas alınan tüm veriler:"},{"sourceCell":"Uygulama Esasları!B18","text":"· Belgelenebilir,"},{"sourceCell":"Uygulama Esasları!B19","text":"· Doğrulanabilir,"},{"sourceCell":"Uygulama Esasları!B20","text":"· Denetime açık,"},{"sourceCell":"Uygulama Esasları!B21","text":"olmak zorundadır."},{"sourceCell":"Uygulama Esasları!B23","text":"2.3 Hesaplama sürecinde doğruluğun ve yeknesaklığın sağlanabilmesi için kanaat/yorum değil, veri ve analiz parametreleri, yargı kararları çerçevesinde esas alınır."},{"sourceCell":"Uygulama Esasları!B24","text":"3. HASAR VE PARÇA DEĞERLENDİRME ESASLARI"},{"sourceCell":"Uygulama Esasları!B25","text":"3.1 Hasar gören parçalar aşağıdaki şekilde sınıflandırılır:"},{"sourceCell":"Uygulama Esasları!B26","text":"· Yapısal Parçalar: şasi, podya sacları ve kuleler, direkler, tavan, taban sacları, ön göğüs sacları,"},{"sourceCell":"Uygulama Esasları!B27","text":"· Yarı Yapısal Parçalar: marşpiyel, arka panel, kaynaklı havuz sacları, yan duvar ve sırt sacları,"},{"sourceCell":"Uygulama Esasları!B28","text":"· Kozmetik Parçalar: kaput, çamurluk, tampon, bagaj kapağı, dolap kapakları vb."},{"sourceCell":"Uygulama Esasları!B29","text":"Her sınıf için, almış olduğu hasara bağlı olarak farklı katsayı ile değerlendirme yapılır. Bu kapsamda, hasar yoğunluğuna göre; hafif –orta- ağır onarım olmak üzere değer kaybına etkisi farklı katsayı ile değerlendirilir."},{"sourceCell":"Uygulama Esasları!B32","text":"3.2 Boya işlemi gören parçalar aşağıdaki şekilde sınıflandırılır:"},{"sourceCell":"Uygulama Esasları!B33","text":"· Lokal boya: düşük etki"},{"sourceCell":"Uygulama Esasları!B34","text":"· Komple boya: orta etki"},{"sourceCell":"Uygulama Esasları!B35","text":"· Çoklu boya: yüksek etki"},{"sourceCell":"Uygulama Esasları!B36","text":"· Parça değişimi: maksimum etki"},{"sourceCell":"Uygulama Esasları!B37","text":"Her sınıf için değer kaybına etkisi farklı katsayı ile değerlendirilir."},{"sourceCell":"Uygulama Esasları!B38","text":"3.3 Hasara uğrayan parçanın onarılması durumunda KDV hariç ve iskontosuz parça bedeli değerlendirmede dikkate alınır. Sigorta eksperi tarafından aracın değer kaybına esas kazasından kaynaklanan hasar onarımına ilişkin bilgi ve belgelerden hasar gören parçaların parça bedelleri ile işçilik bedellerinin tespit edilememesi halinde bu parçalar için doğrudan yüksek onarım katsayısı uygulanır. Parça bedeli hesaplamasında, tespit edilebilmesi halinde araç üzerindeki parçanın türü (orijinal/eşdeğer) dikkate alınır."},{"sourceCell":"Uygulama Esasları!B40","text":"3.4 Onarılan kaporta parçasının KDV'siz ve indirimsiz fiyatının %15' ine kadar hafif, %15-%30 aralığı orta, %30 üzeri ağır onarım kaporta katsayısı olarak değerlendirilir."},{"sourceCell":"Uygulama Esasları!B44","text":"3.5 İlave değerlendirmeler bölümünde yer alan kilometre alt sınır yakınlığı, aracın kilometresinin kilometre çarpan tablosundaki alt sınıra yakınlığının en fazla 1.000 Km olması durumunda dikkate alınır."},{"sourceCell":"Uygulama Esasları!B46","text":"3.6 Araç kullanım türü bölümünde ticari araç ile ifade edilen araç türü; ruhsatında kamyonet olarak geçen koltuklu hususi görünümlü panelvan türü araçlar ile hatlı minibüs, dolmuş, taksi, hatlı otobüstür."},{"sourceCell":"Uygulama Esasları!B50","text":"3.7 Hususi cabrio ve/veya tek kapılı hafif ticari kamyonet tipi araçlarda arka çamurluk hesaplamalarında parça türü olarak sağ/sol yan panel dikkate alınır."},{"sourceCell":"Uygulama Esasları!B54","text":"3.8 Ruhsatında kamyonet olarak geçen koltuklu hususi görünümlü hafif ticari grubu araçlarda değer kaybı hesaplamaları otomobil gurubu hesaplaması üzerinden yapılır ve ticari seçeneği dikkate alınır."},{"sourceCell":"Uygulama Esasları!B56","text":"3.9 Kaporta ve boya onarım katsayısı bölümlerinde boyasız paneller ve plastik karoseri parçaları hesaplamada baz değer kaybı tutarında değerlendirilecek olup ayrıca parça bazlı değerlendirme yapılmayacaktır."},{"sourceCell":"Uygulama Esasları!B60","text":"3.10 Boyasız onarım işlemi yapılan sac aksam onarımlarında sadece hasara konu tazminat tutarı esas alınır. Ayrıca kaporta ve boya katsayısı uygulanmaz."},{"sourceCell":"Uygulama Esasları!B64","text":"3.11 Antika ve Koleksiyon sayılan araçların değer kaybı hesaplaması referans modülle yapılmaz."},{"sourceCell":"Uygulama Esasları!B68","text":"3.12 Aksesuar parçalar değer kaybı hesaplamasında dikkate alınmaz."},{"sourceCell":"Uygulama Esasları!B72","text":"3.13 Değer kaybı tazminat hesaplamasında, değer kaybına konu aracın hasarlı parçaları kazadan önceki tarihte hasara uğramış veya onarım görmüş olmaları durumunda, ilgili parçalar için değer kaybı hesaplaması yapılmaz. (Madde 3.15’te belirtilen durumlar istisna tutulmuştur.)"},{"sourceCell":"Uygulama Esasları!B76","text":"3.14 Geçmiş dönemdeki hasarlardan dolayı onarım görmüş; sökülebilir, takılabilir/civatalı parçaların mevcut hasarda yenisi ile değiştirilmesi halinde değer kaybı hesaplaması yapılmayacaktır."},{"sourceCell":"Uygulama Esasları!B80","text":"3.15 Geçmiş dönemdeki hasarlardan dolayı onarım görmüş; sabit, montajlı/kaynaklı parçalarda, ilgili parçaların sonradan yenisi ile değiştirilmesi halinde değer kaybı hesaplamasında kaporta değişim katsayısı dikkate alınacak, boya katsayısı ise dikkate alınmayacaktır."},{"sourceCell":"Uygulama Esasları!B84","text":"3.16 Kaza tarihinden önce ağır hasara uğramış araçlar ile incelenen kazasında tam ya da ağır hasara uğradığı tespit edilen araçlar için değer kaybı hesaplaması yapılmaz."},{"sourceCell":"Uygulama Esasları!B88","text":"3.17 İş Makinesi, Tarım Makinesi ve Traktör araç guruplarında kullanılmışlık düzeyi kat sayısı; çalışma saati olarak değerlendirilmelidir."},{"sourceCell":"Uygulama Esasları!B92","text":"3.18 Özel amaçlı araçlar ile tanker gurubundaki araçlarda kasa üst yapısı değer kaybı hesaplamasında dikkate alınmaz. Kupa/gövde kısmı ise araç sınıfına göre değerlendirilir."},{"sourceCell":"Uygulama Esasları!B96","text":"3.19 Özel amaçlı araçlar ile tanker gurubundaki araçl